{
  "schemaVersion": 1,
  "caseId": "s9_ep01",
  "seasonId": "s9_sandbox",
  "number": 1,
  "actId": "act1",
  "title": "The Lost Library Key",
  "synopsis": [
    "Story hour starts at ten.",
    "But the Reading Room is locked.",
    "The big brass key is gone!"
  ],
  "goal": "Find out who has the key.",
  "characters": [
    "ms_rosa",
    "mr_bell"
  ],
  "locations": [
    "town_library"
  ],
  "missions": [
    {
      "missionId": "s9_ep01_m1",
      "slot": "m1",
      "placeId": "s9_sandbox.front_desk",
      "puzzle": {
        "paletteId": "text_choice",
        "surface": "mission",
        "engineTable": null,
        "missionType": "multipleChoice",
        "answerSpec": {
          "answer": "shelf",
          "options": [
            {
              "id": "desk",
              "label": "On the front desk",
              "feedback": "Read the note again. Is the desk by the window?"
            },
            {
              "id": "shelf",
              "label": "On the blue shelf by the window"
            },
            {
              "id": "door",
              "label": "In the Reading Room door",
              "feedback": "The door is locked. The key is not in it."
            }
          ]
        },
        "assetNeeds": [],
        "status": "ready",
        "notes": [
          "Letter: Ms. Rosa's note. \"I put the key on the blue shelf by the window. It was 9:00.\"",
          "Question: Where did Ms. Rosa put the key?"
        ]
      },
      "clueInputs": [],
      "clueOutputs": {
        "clue": "s9_ep01_c1",
        "evidence": "s9_ep01_e1"
      },
      "learning": {
        "dependency": "essential",
        "level": "comprehension",
        "objective": "쪽지의 \"on the blue shelf by the window\"를 읽고 열쇠를 둔 곳을 고른다.",
        "skill": "sentenceMeaning",
        "expressions": [
          "I put the key on the blue shelf by the window."
        ]
      }
    },
    {
      "missionId": "s9_ep01_m2",
      "slot": "m2",
      "placeId": "s9_sandbox.front_desk",
      "puzzle": {
        "paletteId": "order_sequence",
        "surface": "mission",
        "engineTable": null,
        "missionType": "sequence",
        "answerSpec": {
          "answer": "tom,bell,lee",
          "options": [
            {
              "id": "lee",
              "label": "Mrs. Lee — 9:40"
            },
            {
              "id": "tom",
              "label": "Tom — 9:10"
            },
            {
              "id": "bell",
              "label": "Mr. Bell — 9:20"
            }
          ],
          "codeLength": 3
        },
        "assetNeeds": [],
        "status": "ready",
        "notes": [
          "Letter: the visitor book. Tom came at 9:10. He read by the door. Mr. Bell came at 9:20. He had a ladder. Mrs. Lee came at 9:40. She sat at the desk.",
          "Question: Put the visitors in order. Who came first?"
        ]
      },
      "clueInputs": [
        {
          "ref": "s9_ep01_c1",
          "use": "textMention",
          "note": "The key was put on the shelf at 9:00: everyone in the book came after it."
        }
      ],
      "clueOutputs": {
        "clue": "s9_ep01_c2",
        "evidence": "s9_ep01_e2"
      },
      "learning": {
        "dependency": "essential",
        "level": "comprehension",
        "objective": "방문 기록의 시각(9:10, 9:20, 9:40)을 읽고 온 순서대로 놓는다.",
        "skill": "vocabulary",
        "expressions": [
          "Who came first?",
          "He came at 9:20."
        ]
      }
    },
    {
      "missionId": "s9_ep01_m3",
      "slot": "m3",
      "placeId": "s9_sandbox.window_shelf",
      "puzzle": {
        "paletteId": "word_entry",
        "surface": "mission",
        "engineTable": null,
        "missionType": "wordInput",
        "answerSpec": {
          "answer": "LAMP",
          "acceptedAnswers": [
            "the lamp"
          ]
        },
        "assetNeeds": [],
        "status": "ready",
        "notes": [
          "Letter: a job card under the blue shelf. \"Mr. Bell: please fix the P-M-A-L in the Reading Room before ten.\" The letters are mixed up.",
          "Question: What must Mr. Bell fix? Put the letters in the right order."
        ]
      },
      "clueInputs": [
        {
          "ref": "s9_ep01_c2",
          "use": "textMention",
          "note": "Mr. Bell came with a ladder: the card says why."
        }
      ],
      "clueOutputs": {
        "clue": "s9_ep01_c3",
        "evidence": "s9_ep01_e3"
      },
      "learning": {
        "dependency": "essential",
        "level": "application",
        "objective": "섞인 글자 P-M-A-L을 바로 놓아 lamp라는 단어를 쓴다.",
        "skill": "vocabulary",
        "expressions": [
          "Please fix the lamp."
        ]
      }
    }
  ],
  "final": {
    "missionId": "s9_ep01_final",
    "slot": "final",
    "placeId": "s9_sandbox.reading_room",
    "puzzle": {
      "paletteId": "letter_tile_lock",
      "surface": "finalMission",
      "engineTable": null,
      "missionType": "letterLock",
      "answerSpec": {
        "answer": "BELL",
        "options": [
          {
            "id": "l1",
            "label": "L"
          },
          {
            "id": "e",
            "label": "E"
          },
          {
            "id": "l2",
            "label": "L"
          },
          {
            "id": "b",
            "label": "B"
          }
        ]
      },
      "assetNeeds": [],
      "status": "ready",
      "notes": [
        "Question: The key was on the shelf at 9:00. Who came with a ladder, and had a job in the Reading Room? Spell the name to open the lock.",
        "No lock box art (lockBoxes is optional): the plain LetterLockQuestion."
      ]
    },
    "clueInputs": [
      {
        "ref": "s9_ep01_c1",
        "use": "answerDerivation",
        "note": "The key was on the shelf from 9:00."
      },
      {
        "ref": "s9_ep01_c2",
        "use": "answerDerivation",
        "note": "Mr. Bell came at 9:20 with a ladder."
      },
      {
        "ref": "s9_ep01_c3",
        "use": "answerDerivation",
        "note": "His job was the lamp in the Reading Room: he needed the key."
      }
    ],
    "clueOutputs": {
      "evidence": "s9_ep01_e4"
    },
    "learning": {
      "dependency": "essential",
      "level": "application",
      "objective": "세 단서(9:00 열쇠, 9:20 사다리, 램프 수리)를 이어 열쇠를 가져간 사람을 찾고 이름을 쓴다.",
      "skill": "sentenceMeaning",
      "expressions": [
        "Who had a job in the Reading Room?"
      ]
    }
  },
  "hook": "The lamp is on. Story hour can start!",
  "learningGoal": {
    "title": "Where and when: by, on, at",
    "titleKo": "장소와 시간: by, on, at"
  },
  "notes": [
    "STEP 3-6 trial case. Written for this sandbox only: no London or Paris text, place or picture.",
    "Every puzzle is a ready text-only palette puzzle: no new picture or sound.",
    "Places (front_desk, window_shelf, reading_room) are plan ids only: no ScenePlace is registered for them."
  ]
}
